{
 "format": 1,
 "model": "queue-factor-profile-1",
 "fitted_at": "2026-09-21T02:00:00Z",
 "history": {
  "start": "2026-09-07T00:00:00Z",
  "end": "2026-09-20T23:59:00Z",
  "polls": 20160
 },
 "timezone": "Europe/Dublin",
 "mode": "bike",
 "rules": {
  "vehicle_type_id": "3645",
  "min_range_m": 10000.0,
  "bay_distance_m": 20.0,
  "move_m": 100.0,
  "stale_max_min": 25.0,
  "hysteresis_polls": 2,
  "reach_m": 300.0,
  "detour_factor": 1.3
 },
 "suspect_share": 0.68,
 "min_states": 40,
 "arrival": {
  "profile": [
   0.002380952380952381,
   0.0025793650793650793,
   0.0011904761904761906,
   0.001388888888888889,
   0.0021825396825396826,
   0.002777777777777778,
   0.0025793650793650793,
   0.002380952380952381,
   0.004563492063492064,
   0.00496031746031746,
   0.0031746031746031746,
   0.0025793650793650793,
   0.0017857142857142857,
   0.0031746031746031746,
   0.002380952380952381,
   0.002777777777777778,
   0.0035714285714285713,
   0.003373015873015873,
   0.004761904761904762,
   0.004761904761904762,
   0.002976190476190476,
   0.002777777777777778,
   0.0015873015873015873,
   0.0021825396825396826,
   0.0017857142857142857,
   0.002380952380952381,
   0.001984126984126984,
   0.0021825396825396826,
   0.0031746031746031746,
   0.0017857142857142857,
   0.0017857142857142857,
   0.003373015873015873,
   0.0021825396825396826,
   0.003373015873015873,
   0.002380952380952381,
   0.0021825396825396826,
   0.002380952380952381,
   0.002777777777777778,
   0.0031746031746031746,
   0.002380952380952381,
   0.0031746031746031746,
   0.002380952380952381,
   0.0021825396825396826,
   0.002777777777777778,
   0.002380952380952381,
   0.0021825396825396826,
   0.002380952380952381,
   0.001984126984126984
  ],
  "strength": 1.4303471657643014,
  "bays": {
   "8c3de2a7e361d326a4e777298593a90fa8f00371e258b61be9cc7a432f6fa765": [
    32.0,
    53.583333333333336
   ],
   "d1ecaef93a01b6930f22ea5cd9d5f78282e11ff5c7a8e28ef3010613f9f26441": [
    149.0,
    53.583333333333336
   ],
   "28c9f827514bee8c0ce306c423d8c1e013fc4a670a1653747673489288606e98": [
    35.0,
    53.583333333333336
   ],
   "be32320d5bf0422801c06dfb9dac45c6d134b38a5e2a2e6cb57bc128f65a1619": [
    34.0,
    53.583333333333336
   ],
   "c256d588d55326e2d937fb70e7977ce25f862f9af97fa9cabdb408e1a82fdab0": [
    103.0,
    53.583333333333336
   ],
   "174f2d9bcf7939b439baf6de87eae50b432e3447999db885b97c751e48c0375d": [
    56.0,
    53.583333333333336
   ],
   "01f69fa771af0391d0c3dd8e21a52e501151594ef8d1f8f24767f1b57fb505c9": [
    25.0,
    53.583333333333336
   ],
   "98ea5b55f9f8b0308cec9437ba73708d38b20d996447889568afbba74b61f5c6": [
    124.0,
    53.583333333333336
   ],
   "31e4c852e32fa0622fad0d9a77f26494a9e572852bfcab086cbd95032c3d9762": [
    53.0,
    53.583333333333336
   ],
   "ade55a7ccf8dcad4c40740e3d97664fbe3f150d695b661779c0a8869a43e78f6": [
    32.0,
    53.583333333333336
   ],
   "e3ff39a3696bf99609a797f03808ef96441d2e97bad2f0097d102581d8296219": [
    0.0,
    53.583333333333336
   ],
   "9ec09ce760772c01d16279d474e543eaa0a3e7a33de96e8b4333be1fd1152cd4": [
    0.0,
    53.583333333333336
   ]
  }
 },
 "departure": {
  "profile": [
   0.00145022049273435,
   0.0016113561030381667,
   0.002094762933949617,
   0.0019336273236458,
   0.00145022049273435,
   0.002094762933949617,
   0.00145022049273435,
   0.0030615765957725167,
   0.0027393053751648836,
   0.0035449834266839666,
   0.00241703415455725,
   0.002094762933949617,
   0.00241703415455725,
   0.0027393053751648836,
   0.0019336273236458,
   0.0012890848824305334,
   0.0016113561030381667,
   0.002094762933949617,
   0.0029004409854687,
   0.002094762933949617,
   0.00241703415455725,
   0.0017724917133419833,
   0.0019336273236458,
   0.0012890848824305334,
   0.0017724917133419833,
   0.0011279492721267166,
   0.00241703415455725,
   0.0027393053751648836,
   0.002094762933949617,
   0.002578169764861067,
   0.00145022049273435,
   0.002094762933949617,
   0.0032227122060763335,
   0.0033838478163801503,
   0.0027393053751648836,
   0.00241703415455725,
   0.0017724917133419833,
   0.00145022049273435,
   0.00145022049273435,
   0.002578169764861067,
   0.002578169764861067,
   0.0022558985442534332,
   0.0019336273236458,
   0.0027393053751648836,
   0.0037061190369877834,
   0.00145022049273435,
   0.0016113561030381667,
   0.0019336273236458
  ],
  "strength": 1.4837411794498943,
  "bays": {
   "8c3de2a7e361d326a4e777298593a90fa8f00371e258b61be9cc7a432f6fa765": [
    59.0,
    87.16837927803329
   ],
   "d1ecaef93a01b6930f22ea5cd9d5f78282e11ff5c7a8e28ef3010613f9f26441": [
    78.0,
    29.060227861570375
   ],
   "28c9f827514bee8c0ce306c423d8c1e013fc4a670a1653747673489288606e98": [
    29.0,
    48.3839417744755
   ],
   "be32320d5bf0422801c06dfb9dac45c6d134b38a5e2a2e6cb57bc128f65a1619": [
    46.0,
    81.6770071165958
   ],
   "c256d588d55326e2d937fb70e7977ce25f862f9af97fa9cabdb408e1a82fdab0": [
    54.0,
    35.78526560670278
   ],
   "174f2d9bcf7939b439baf6de87eae50b432e3447999db885b97c751e48c0375d": [
    83.0,
    46.805257029094676
   ],
   "01f69fa771af0391d0c3dd8e21a52e501151594ef8d1f8f24767f1b57fb505c9": [
    46.0,
    40.695007075234585
   ],
   "98ea5b55f9f8b0308cec9437ba73708d38b20d996447889568afbba74b61f5c6": [
    135.0,
    51.695372080611506
   ],
   "31e4c852e32fa0622fad0d9a77f26494a9e572852bfcab086cbd95032c3d9762": [
    83.0,
    56.90369226879824
   ],
   "ade55a7ccf8dcad4c40740e3d97664fbe3f150d695b661779c0a8869a43e78f6": [
    32.0,
    62.01511613978266
   ],
   "e3ff39a3696bf99609a797f03808ef96441d2e97bad2f0097d102581d8296219": [
    0.0,
    104.81073376910064
   ]
  }
 },
 "places": {
  "a": {
   "bays": [
    "28c9f827514bee8c0ce306c423d8c1e013fc4a670a1653747673489288606e98",
    "8c3de2a7e361d326a4e777298593a90fa8f00371e258b61be9cc7a432f6fa765",
    "d1ecaef93a01b6930f22ea5cd9d5f78282e11ff5c7a8e28ef3010613f9f26441"
   ]
  },
  "b": {
   "bays": [
    "be32320d5bf0422801c06dfb9dac45c6d134b38a5e2a2e6cb57bc128f65a1619"
   ]
  },
  "c": {
   "bays": [
    "01f69fa771af0391d0c3dd8e21a52e501151594ef8d1f8f24767f1b57fb505c9",
    "174f2d9bcf7939b439baf6de87eae50b432e3447999db885b97c751e48c0375d",
    "31e4c852e32fa0622fad0d9a77f26494a9e572852bfcab086cbd95032c3d9762",
    "98ea5b55f9f8b0308cec9437ba73708d38b20d996447889568afbba74b61f5c6",
    "ade55a7ccf8dcad4c40740e3d97664fbe3f150d695b661779c0a8869a43e78f6",
    "c256d588d55326e2d937fb70e7977ce25f862f9af97fa9cabdb408e1a82fdab0"
   ]
  }
 },
 "backtest": []
}
